{
  "base_expression": "SONG_POINTERS",
  "block_label": "SongBank_Underworld_Main",
  "entries": [
    {
      "alias_of_track_index": null,
      "is_empty": true,
      "pointer_entry_file_offset": 884740,
      "pointer_expression": "$0000",
      "source_comment_index": 1,
      "source_line": 27,
      "source_revision": "347c23f9fc019c72d32da537c9cb235f468d021d",
      "table_index": 0,
      "target_label": null,
      "track_index": 1
    },
    {
      "alias_of_track_index": null,
      "is_empty": true,
      "pointer_entry_file_offset": 884742,
      "pointer_expression": "$0000",
      "source_comment_index": 2,
      "source_line": 28,
      "source_revision": "347c23f9fc019c72d32da537c9cb235f468d021d",
      "table_index": 1,
      "target_label": null,
      "track_index": 2
    },
    {
      "alias_of_track_index": null,
      "is_empty": true,
      "pointer_entry_file_offset": 884744,
      "pointer_expression": "$0000",
      "source_comment_index": 3,
      "source_line": 29,
      "source_revision": "347c23f9fc019c72d32da537c9cb235f468d021d",
      "table_index": 2,
      "target_label": null,
      "track_index": 3
    },
    {
      "alias_of_track_index": null,
      "is_empty": true,
      "pointer_entry_file_offset": 884746,
      "pointer_expression": "$0000",
      "source_comment_index": 4,
      "source_line": 30,
      "source_revision": "347c23f9fc019c72d32da537c9cb235f468d021d",
      "table_index": 3,
      "target_label": null,
      "track_index": 4
    },
    {
      "alias_of_track_index": null,
      "is_empty": true,
      "pointer_entry_file_offset": 884748,
      "pointer_expression": "$0000",
      "source_comment_index": 5,
      "source_line": 31,
      "source_revision": "347c23f9fc019c72d32da537c9cb235f468d021d",
      "table_index": 4,
      "target_label": null,
      "track_index": 5
    },
    {
      "alias_of_track_index": null,
      "is_empty": true,
      "pointer_entry_file_offset": 884750,
      "pointer_expression": "$0000",
      "source_comment_index": 6,
      "source_line": 32,
      "source_revision": "347c23f9fc019c72d32da537c9cb235f468d021d",
      "table_index": 5,
      "target_label": null,
      "track_index": 6
    },
    {
      "alias_of_track_index": null,
      "is_empty": true,
      "pointer_entry_file_offset": 884752,
      "pointer_expression": "$0000",
      "source_comment_index": 7,
      "source_line": 33,
      "source_revision": "347c23f9fc019c72d32da537c9cb235f468d021d",
      "table_index": 6,
      "target_label": null,
      "track_index": 7
    },
    {
      "alias_of_track_index": null,
      "is_empty": true,
      "pointer_entry_file_offset": 884754,
      "pointer_expression": "$0000",
      "source_comment_index": 8,
      "source_line": 34,
      "source_revision": "347c23f9fc019c72d32da537c9cb235f468d021d",
      "table_index": 7,
      "target_label": null,
      "track_index": 8
    },
    {
      "alias_of_track_index": null,
      "is_empty": true,
      "pointer_entry_file_offset": 884756,
      "pointer_expression": "$0000",
      "source_comment_index": 9,
      "source_line": 35,
      "source_revision": "347c23f9fc019c72d32da537c9cb235f468d021d",
      "table_index": 8,
      "target_label": null,
      "track_index": 9
    },
    {
      "alias_of_track_index": null,
      "is_empty": true,
      "pointer_entry_file_offset": 884758,
      "pointer_expression": "$0000",
      "source_comment_index": 10,
      "source_line": 36,
      "source_revision": "347c23f9fc019c72d32da537c9cb235f468d021d",
      "table_index": 9,
      "target_label": null,
      "track_index": 10
    },
    {
      "alias_of_track_index": null,
      "is_empty": false,
      "pointer_entry_file_offset": 884760,
      "pointer_expression": "Song0B_FairyTheme",
      "source_comment_index": 11,
      "source_line": 37,
      "source_revision": "347c23f9fc019c72d32da537c9cb235f468d021d",
      "table_index": 10,
      "target_label": "Song0B_FairyTheme",
      "track_index": 11
    },
    {
      "alias_of_track_index": null,
      "is_empty": true,
      "pointer_entry_file_offset": 884762,
      "pointer_expression": "$0000",
      "source_comment_index": 12,
      "source_line": 38,
      "source_revision": "347c23f9fc019c72d32da537c9cb235f468d021d",
      "table_index": 11,
      "target_label": null,
      "track_index": 12
    },
    {
      "alias_of_track_index": null,
      "is_empty": true,
      "pointer_entry_file_offset": 884764,
      "pointer_expression": "$0000",
      "source_comment_index": 13,
      "source_line": 39,
      "source_revision": "347c23f9fc019c72d32da537c9cb235f468d021d",
      "table_index": 12,
      "target_label": null,
      "track_index": 13
    },
    {
      "alias_of_track_index": null,
      "is_empty": true,
      "pointer_entry_file_offset": 884766,
      "pointer_expression": "$0000",
      "source_comment_index": 14,
      "source_line": 40,
      "source_revision": "347c23f9fc019c72d32da537c9cb235f468d021d",
      "table_index": 13,
      "target_label": null,
      "track_index": 14
    },
    {
      "alias_of_track_index": null,
      "is_empty": true,
      "pointer_entry_file_offset": 884768,
      "pointer_expression": "$0000",
      "source_comment_index": 15,
      "source_line": 41,
      "source_revision": "347c23f9fc019c72d32da537c9cb235f468d021d",
      "table_index": 14,
      "target_label": null,
      "track_index": 15
    },
    {
      "alias_of_track_index": null,
      "is_empty": false,
      "pointer_entry_file_offset": 884770,
      "pointer_expression": "Song10_HyruleCastle",
      "source_comment_index": 16,
      "source_line": 42,
      "source_revision": "347c23f9fc019c72d32da537c9cb235f468d021d",
      "table_index": 15,
      "target_label": "Song10_HyruleCastle",
      "track_index": 16
    },
    {
      "alias_of_track_index": null,
      "is_empty": false,
      "pointer_entry_file_offset": 884772,
      "pointer_expression": "Song11_PendantDungeon",
      "source_comment_index": 17,
      "source_line": 43,
      "source_revision": "347c23f9fc019c72d32da537c9cb235f468d021d",
      "table_index": 16,
      "target_label": "Song11_PendantDungeon",
      "track_index": 17
    },
    {
      "alias_of_track_index": null,
      "is_empty": false,
      "pointer_entry_file_offset": 884774,
      "pointer_expression": "Song12_Cave",
      "source_comment_index": 18,
      "source_line": 44,
      "source_revision": "347c23f9fc019c72d32da537c9cb235f468d021d",
      "table_index": 17,
      "target_label": "Song12_Cave",
      "track_index": 18
    },
    {
      "alias_of_track_index": null,
      "is_empty": false,
      "pointer_entry_file_offset": 884776,
      "pointer_expression": "Song13_Fanfare",
      "source_comment_index": 19,
      "source_line": 45,
      "source_revision": "347c23f9fc019c72d32da537c9cb235f468d021d",
      "table_index": 18,
      "target_label": "Song13_Fanfare",
      "track_index": 19
    },
    {
      "alias_of_track_index": null,
      "is_empty": false,
      "pointer_entry_file_offset": 884778,
      "pointer_expression": "Song14_Sanctuary",
      "source_comment_index": 20,
      "source_line": 46,
      "source_revision": "347c23f9fc019c72d32da537c9cb235f468d021d",
      "table_index": 19,
      "target_label": "Song14_Sanctuary",
      "track_index": 20
    },
    {
      "alias_of_track_index": null,
      "is_empty": false,
      "pointer_entry_file_offset": 884780,
      "pointer_expression": "Song15_Boss",
      "source_comment_index": 21,
      "source_line": 47,
      "source_revision": "347c23f9fc019c72d32da537c9cb235f468d021d",
      "table_index": 20,
      "target_label": "Song15_Boss",
      "track_index": 21
    },
    {
      "alias_of_track_index": null,
      "is_empty": false,
      "pointer_entry_file_offset": 884782,
      "pointer_expression": "Song16_CrystalDungeon",
      "source_comment_index": 22,
      "source_line": 48,
      "source_revision": "347c23f9fc019c72d32da537c9cb235f468d021d",
      "table_index": 21,
      "target_label": "Song16_CrystalDungeon",
      "track_index": 22
    },
    {
      "alias_of_track_index": null,
      "is_empty": false,
      "pointer_entry_file_offset": 884784,
      "pointer_expression": "Song17_Shop",
      "source_comment_index": 23,
      "source_line": 49,
      "source_revision": "347c23f9fc019c72d32da537c9cb235f468d021d",
      "table_index": 22,
      "target_label": "Song17_Shop",
      "track_index": 23
    },
    {
      "alias_of_track_index": 18,
      "is_empty": false,
      "pointer_entry_file_offset": 884786,
      "pointer_expression": "Song12_Cave",
      "source_comment_index": 24,
      "source_line": 50,
      "source_revision": "347c23f9fc019c72d32da537c9cb235f468d021d",
      "table_index": 23,
      "target_label": "Song12_Cave",
      "track_index": 24
    },
    {
      "alias_of_track_index": null,
      "is_empty": false,
      "pointer_entry_file_offset": 884788,
      "pointer_expression": "Song19_ZeldaRescue",
      "source_comment_index": 25,
      "source_line": 51,
      "source_revision": "347c23f9fc019c72d32da537c9cb235f468d021d",
      "table_index": 24,
      "target_label": "Song19_ZeldaRescue",
      "track_index": 25
    },
    {
      "alias_of_track_index": null,
      "is_empty": false,
      "pointer_entry_file_offset": 884790,
      "pointer_expression": "Song1A_CrystalMaiden",
      "source_comment_index": 26,
      "source_line": 52,
      "source_revision": "347c23f9fc019c72d32da537c9cb235f468d021d",
      "table_index": 25,
      "target_label": "Song1A_CrystalMaiden",
      "track_index": 26
    },
    {
      "alias_of_track_index": null,
      "is_empty": false,
      "pointer_entry_file_offset": 884792,
      "pointer_expression": "Song1B_BigFairy",
      "source_comment_index": 27,
      "source_line": 53,
      "source_revision": "347c23f9fc019c72d32da537c9cb235f468d021d",
      "table_index": 26,